{
  "schemaVersion": "https://example.invalid/issueready/curated-issue-fixture-catalog/v1alpha1",
  "kind": "CuratedIssueFixtureCatalog",
  "purpose": "DEVELOPER_BEHAVIOR_REGRESSION",
  "limitations": {
    "accuracyClaim": false,
    "calibrationUse": false,
    "heldOut": false
  },
  "semanticProfile": {
    "id": "curated-regression-v1",
    "revision": 1,
    "digest": "sha256:21a57e9e2bd0a36ff7dc214c31b665da92e4d457bef0e1463da3839b6ec84dcd"
  },
  "rights": {
    "rightsBasis": "project-authored-synthetic",
    "rawTextIncluded": true,
    "permission": {
      "status": "not-required-project-authored",
      "grantedBy": "IssueReady project",
      "scope": [
        "behavior-regression",
        "public-distribution-under-project-license"
      ]
    },
    "apiTerms": {
      "host": null,
      "reviewedAt": null,
      "policyDigest": null
    },
    "annotationLicense": "MIT",
    "consent": {
      "required": false,
      "status": "not-applicable-synthetic",
      "scope": []
    },
    "retention": {
      "rawDays": null,
      "derivedDays": null,
      "policy": "source-controlled-project-fixture"
    },
    "deletion": {
      "method": "remove-from-future-revisions",
      "contact": "https://github.com/whyiug/issueready/issues",
      "slaDays": null
    },
    "provenance": {
      "collector": "IssueReady project",
      "createdAt": "2026-07-18T19:00:00Z"
    }
  },
  "fixtures": [
    {
      "id": "curated-bug-reconnect-deduplication",
      "taskType": "bug",
      "policyFixture": "default",
      "input": {
        "title": "Prevent duplicate retry notices after reconnect",
        "body": "## Goal\nKeep one retry notice per job after a websocket reconnect.\n\n## Observed behavior\nAfter the client reconnects, `RetryNoticeStore.add()` appends the active job twice.\n\n## Expected behavior\nReconnect processing reuses the existing notice for the same job identifier.\n\n## Reproduction\nStart one job, disconnect the websocket, reconnect once, and inspect the notice list.\n\n## Acceptance criteria\n- A reconnect adds exactly one retry notice for the active job.\n- A second reconnect remains idempotent.\n- Notices for different job identifiers remain distinct.\n\n## Validation\nRun `pnpm --filter @example/client test retry-notice`.\n\n## Constraints\nUse the existing job identifier as the deduplication key. No schema migration is required.",
        "labels": ["bug"],
        "nativeIssueType": null,
        "changedPaths": []
      },
      "semanticSignals": [
        {
          "ruleId": "IR-ACC-001",
          "source": "semantic-criterion:observable-acceptance",
          "outcome": "PASS",
          "evidence": [
            {
              "document": "issue.body",
              "quote": "A reconnect adds exactly one retry notice for the active job."
            }
          ]
        },
        {
          "ruleId": "IR-ACC-002",
          "source": "semantic-criterion:goal-acceptance-alignment",
          "outcome": "PASS",
          "evidence": [
            {
              "document": "issue.body",
              "quote": "Keep one retry notice per job after a websocket reconnect."
            }
          ]
        },
        {
          "ruleId": "IR-BUG-001",
          "source": "semantic-criterion:observed-expected-distinction",
          "outcome": "PASS",
          "evidence": [
            {
              "document": "issue.body",
              "quote": "After the client reconnects, `RetryNoticeStore.add()` appends the active job twice."
            }
          ]
        },
        {
          "ruleId": "IR-COH-001",
          "source": "semantic-criterion:problem-scope-acceptance-validation-coherence",
          "outcome": "PASS",
          "evidence": [
            {
              "document": "issue.body",
              "quote": "Reconnect processing reuses the existing notice for the same job identifier."
            }
          ]
        },
        {
          "ruleId": "IR-DEF-001",
          "source": "semantic-criterion:concrete-work",
          "outcome": "PASS",
          "evidence": [
            {
              "document": "issue.title",
              "quote": "Prevent duplicate retry notices after reconnect"
            }
          ]
        },
        {
          "ruleId": "IR-DEF-002",
          "source": "semantic-criterion:independent-restatement",
          "outcome": "PASS",
          "evidence": [
            {
              "document": "issue.body",
              "quote": "Keep one retry notice per job after a websocket reconnect."
            }
          ]
        },
        {
          "ruleId": "IR-DEF-003",
          "source": "semantic-criterion:decisive-ambiguity",
          "outcome": "PASS",
          "evidence": [
            {
              "document": "issue.body",
              "quote": "Use the existing job identifier as the deduplication key."
            }
          ]
        },
        {
          "ruleId": "IR-DEF-004",
          "source": "semantic-criterion:cross-source-contradiction",
          "outcome": "PASS",
          "evidence": [
            {
              "document": "issue.body",
              "quote": "Notices for different job identifiers remain distinct."
            }
          ]
        },
        {
          "ruleId": "IR-SCP-001",
          "source": "semantic-criterion:primary-goal",
          "outcome": "PASS",
          "evidence": [
            {
              "document": "issue.body",
              "quote": "Keep one retry notice per job after a websocket reconnect."
            }
          ]
        },
        {
          "ruleId": "IR-SCP-002",
          "source": "semantic-criterion:separable-goals",
          "outcome": "PASS",
          "evidence": [
            {
              "document": "issue.body",
              "quote": "Keep one retry notice per job after a websocket reconnect."
            }
          ]
        },
        {
          "ruleId": "IR-BUG-002",
          "source": "semantic-criterion:reproduction-or-constraint",
          "outcome": "PASS",
          "evidence": [
            {
              "document": "issue.body",
              "quote": "Start one job, disconnect the websocket, reconnect once, and inspect the notice list."
            }
          ]
        },
        {
          "ruleId": "IR-CTX-002",
          "source": "semantic-criterion:required-prerequisites",
          "outcome": "NOT_APPLICABLE",
          "evidence": []
        },
        {
          "ruleId": "IR-DEP-001",
          "source": "semantic-criterion:dependency-contract",
          "outcome": "NOT_APPLICABLE",
          "evidence": []
        },
        {
          "ruleId": "IR-EDG-001",
          "source": "semantic-criterion:critical-edge-behavior",
          "outcome": "PASS",
          "evidence": [
            {
              "document": "issue.body",
              "quote": "A second reconnect remains idempotent."
            }
          ]
        },
        {
          "ruleId": "IR-FRESH-001",
          "source": "semantic-criterion:version-freshness",
          "outcome": "NOT_APPLICABLE",
          "evidence": []
        },
        {
          "ruleId": "IR-PERF-001",
          "source": "semantic-criterion:performance-workload-measurement",
          "outcome": "NOT_APPLICABLE",
          "evidence": []
        },
        {
          "ruleId": "IR-SCP-003",
          "source": "semantic-criterion:cross-boundary-contract",
          "outcome": "NOT_APPLICABLE",
          "evidence": []
        },
        {
          "ruleId": "IR-VAL-001",
          "source": "semantic-criterion:applicable-validation",
          "outcome": "PASS",
          "evidence": [
            {
              "document": "issue.body",
              "quote": "Run `pnpm --filter @example/client test retry-notice`."
            }
          ]
        }
      ],
      "expected": {
        "evaluationStatus": "COMPLETE",
        "specVerdict": "READY",
        "delegationDisposition": "CANDIDATE",
        "blockingRuleIds": [],
        "evaluationReasons": []
      },
      "provenance": {
        "sourceDigest": "sha256:2eb60352b9fcbefbaab1736f548b760a5cd3e649ef69a9357faa08b830b60bc0",
        "transformDigest": "sha256:5d6c524c8068e3bda8ef6f56ea8766e6397406d05cc6e1e8bc2bcc483391b420"
      },
      "review": {
        "status": "DEVELOPER_REVIEWED",
        "reviewedAt": "2026-07-18",
        "claimScope": "BEHAVIOR_REGRESSION_ONLY"
      }
    },
    {
      "id": "curated-feature-export-date-filter",
      "taskType": "feature",
      "policyFixture": "default",
      "input": {
        "title": "Add a date-range filter to audit-log export",
        "body": "## Goal\nLet maintainers export audit events for a selected start and end date.\n\n## Context\nThe audit page already renders a date picker in `apps/admin/audit.tsx`.\n\n## Acceptance criteria\n- The export button remains visible on the audit page.\n- The downloaded file uses the existing CSV column order.\n\n## Validation\nRun the admin audit component tests.\n\n## Open decision\nThe issue does not define whether the selected dates are inclusive or which timezone controls the boundaries.",
        "labels": ["enhancement"],
        "nativeIssueType": null,
        "changedPaths": []
      },
      "semanticSignals": [
        {
          "ruleId": "IR-ACC-001",
          "source": "semantic-criterion:observable-acceptance",
          "outcome": "PASS",
          "evidence": [
            {
              "document": "issue.body",
              "quote": "The export button remains visible on the audit page."
            }
          ]
        },
        {
          "ruleId": "IR-ACC-002",
          "source": "semantic-criterion:goal-acceptance-alignment",
          "outcome": "FAIL",
          "evidence": [
            {
              "document": "issue.body",